PsycHIRE — Feature Tracker,,,,,,,
161,Admin,Overview,Admin dashboard home,"A summary view showing pending review counts per module, recent platform activity, and flagged items.",Core,Done,Done
162,Admin,Review Queue,Review listings,"All submitted listings across every module appear in a unified review queue, organised by module tabs and filterable by status.",Core,Done,Done
163,Admin,Review Queue,Approve a listing,Admin approves a listing; it immediately goes live on the platform.,Core,Done,Done
164,Admin,Review Queue,Reject a listing,Admin rejects a listing with a written message. The poster is notified and can revise and resubmit.,Core,Done,Pending
165,Admin,Review Queue,Request edits,Admin can request specific changes from the poster without fully rejecting the listing.,Core,Done,Done
166,Admin,Review Queue,Bulk approve,Select multiple listings and approve them in a single action.,Enhanced,Done,Done
167,Admin,Reports,Reports queue,"All user-flagged listings appear here with the reporter's identity, reason, and the listing in context.",Standard,Done,Done
168,Admin,Reports,Handle a report,"Admin can warn the poster, remove the listing, or dismiss the report.",Standard,Done,Pending
169,Admin,Statistics,Platform statistics,"Charts showing: listings created per month, applications per listing, time-to-approve, listings by module, and user growth over time.",Enhanced,Done,Done
170,Admin,Content Management,Taxonomy management,"Add, edit, or delete the platform's categories, specializations, skills, and filter options used across all modules.",Enhanced,Done,Done
PLATFORM FEATURES,,,,,,,
171,Platform Features,Messaging,Direct messaging,Users can message any other member from their profile or card. A full-screen conversation view shows message history with sent/received bubbles.,Standard,Done,Done
172,Platform Features,Messaging,Conversation search,Search through existing conversations by name to quickly find a thread.,Standard,Done,Pending
173,Platform Features,Reviews & Ratings,"Reviews on courses, mentors & supervisors","After completing a course or supervision, users leave a star rating and written review. Reviews display with a rating distribution bar.",Standard,Done,Pending
174,Platform Features,Reviews & Ratings,Profile reviews,"Users can receive reviews on their profile, visible to anyone who visits it.",Standard,Done,Pending
175,Platform Features,Share & Report,Share any listing,"Every listing across all modules can be shared via WhatsApp, email, LinkedIn, or a copy link.",Core,Done,Done
176,Platform Features,Share & Report,Report any listing,Any user can flag a listing as inappropriate. Reports go directly to the admin reports queue.,Core,Done,Done
177,Platform Features,Currency,Multi-currency display,"Fees, salaries, and compensation across the platform display in the correct currency symbol (₹ INR, $ USD, £ GBP, € EUR).",Standard,Done,Done
177 features · All P0–P3 items built · 1 known gap (Projects: view applicants) ,,,,,,,
,,,,,,,
,,,,,,,
,,,,,,,
PsycHIRE — Known Gaps & Deferred Items,,,,,,,
Module,Area,Feature,Flow / Notes,Priority,Build,QA,Reason
Projects,Management,ProjectApplicationsPage,Listing card → 'Applications' → view/respond to applicants,P2,Not Started,Blocked,Page file missing; navigation exists but no component
Platform,Payment,Payment gateway integration,Checkout → Razorpay/Stripe → receipt,P4,Deferred,—,Phase II; mark with 'Payment Pending' in UI
Platform,Payment,Invoice generation,Completed payment → generate PDF invoice,P4,Deferred,—,Depends on payment
Platform,Email,Real email sending,Notification triggers → actual email delivery,P4,Deferred,—,UI shows templates; backend needed
Platform,AI,AI-matched recommendations,ML-based profile-to-listing matching,P4,Deferred,—,Current 'recommended' uses mock data
Platform,Collab,Collaboration Hub,Post-selection workspace for projects,P4,Deferred,—,Needs spec from reference site
Platform,Payment,Revenue sharing,Platform fee calculation and distribution,P4,Deferred,—,"Business logic, not UI"